{
  "$schema": "https://json-schema.org/draft/2020-12/schema",
  "title": "AIO CODE Entity Graph",
  "type": "object",
  "required": ["graph", "version", "nodes", "edges"],
  "properties": {
    "graph": {"type": "string"},
    "version": {"type": "string"},
    "updated": {"type": "string", "format": "date"},
    "graph_rule": {"type": "string"},
    "ecosystem_rule": {"type": "string"},
    "nodes": {
      "type": "array",
      "items": {
        "type": "object",
        "required": ["entity_id", "canonical_name", "entity_type"],
        "properties": {
          "entity_id": {"type": "string"},
          "canonical_name": {"type": "string"},
          "entity_type": {"type": "string"},
          "passport": {"type": "string"},
          "content_registry": {"type": "string"},
          "platform_registry": {"type": "string"},
          "research_layers": {"type": "array", "items": {"type": "string"}}
        },
        "additionalProperties": false
      }
    },
    "edges": {
      "type": "array",
      "items": {
        "type": "object",
        "required": ["relationship_id", "from", "relationship", "to", "status"],
        "properties": {
          "relationship_id": {"type": "string"},
          "from": {"type": "string"},
          "relationship": {"type": "string"},
          "to": {"type": "string"},
          "status": {"type": "string"},
          "source_ref": {"type": "string"},
          "note": {"type": "string"}
        },
        "additionalProperties": false
      }
    }
  },
  "additionalProperties": false
}
