{
  "graph": "OZCU / AIO CODE Entity Graph",
  "version": "1.6",
  "updated": "2026-10-17",
  "nodes": [
    {
      "entity_id": "OZCU-001",
      "canonical_name": "OZCU",
      "entity_type": "Company",
      "passport": "entity/ENTITY-PASSPORT-OZCU.md"
    },
    {
      "entity_id": "MC-001",
      "canonical_name": "Marii Cuadros",
      "entity_type": "Person",
      "passport": "entity/ENTITY-PASSPORT-MARII-CUADROS.md",
      "content_registry": "entity/content/MC-001/content-registry.json",
      "platform_registry": "entity/content/MC-001/platforms.json"
    },
    {
      "entity_id": "AIO-001",
      "canonical_name": "AIO CODE",
      "entity_type": "DigitalEntityOperatingSystem",
      "passport": "entity/ENTITY-PASSPORT-AIO-CODE.md",
      "content_registry": "entity/content/AIO-001/content-registry.json",
      "platform_registry": "entity/content/AIO-001/platforms.json",
      "research_layers": [
        "observatory/",
        "entity-labs/",
        "metrics/",
        "ethics/",
        "logbook/"
      ]
    },
    {
      "entity_id": "NUX-001",
      "canonical_name": "NUX",
      "entity_type": "DigitalCreativeEntity",
      "passport": "entity/ENTITY-PASSPORT-NUX.md",
      "content_registry": "entity/content/NUX-001/content-registry.json",
      "platform_registry": "entity/content/NUX-001/platforms.json"
    },
    {
      "entity_id": "VOID-001",
      "canonical_name": "VOID MODE",
      "entity_type": "CreativeSystem",
      "passport": "entity/ENTITY-PASSPORT-VOID-MODE.md"
    },
    {
      "entity_id": "DAN-001",
      "canonical_name": "DANISAN",
      "entity_type": "Person",
      "passport": "entity/ENTITY-PASSPORT-DANISAN.md",
      "platform_registry": "entity/content/DAN-001/platforms.json"
    }
  ],
  "edges": [
    {
      "relationship_id": "REL-001",
      "from": "MC-001",
      "relationship": "creator_of",
      "to": "AIO-001",
      "status": "active",
      "source_ref": "ENTITY-MASTER-RECORD.md"
    },
    {
      "relationship_id": "REL-002",
      "from": "MC-001",
      "relationship": "develops",
      "to": "NUX-001",
      "status": "active",
      "source_ref": "entity/ENTITY-PASSPORT-NUX.md",
      "note": "NUX is a distinct entity. The broader creative role semantics may be refined as documented evidence accumulates."
    },
    {
      "relationship_id": "REL-003",
      "from": "MC-001",
      "relationship": "CEO_of",
      "to": "OZCU-001",
      "status": "active",
      "source_ref": "ENTITY-MASTER-RECORD.md"
    },
    {
      "relationship_id": "REL-004",
      "from": "MC-001",
      "relationship": "develops",
      "to": "VOID-001",
      "status": "active",
      "source_ref": "ENTITY-MASTER-RECORD.md"
    },
    {
      "relationship_id": "REL-005",
      "from": "OZCU-001",
      "relationship": "applies",
      "to": "AIO-001",
      "status": "active",
      "source_ref": "ENTITY-MASTER-RECORD.md"
    },
    {
      "relationship_id": "REL-006",
      "from": "OZCU-001",
      "relationship": "offers",
      "to": "VOID-001",
      "status": "active",
      "source_ref": "ENTITY-MASTER-RECORD.md"
    },
    {
      "relationship_id": "REL-007",
      "from": "AIO-001",
      "relationship": "includes_creative_system",
      "to": "VOID-001",
      "status": "active",
      "source_ref": "entity/ENTITY-PASSPORT-AIO-CODE.md"
    },
    {
      "relationship_id": "REL-008",
      "from": "MC-001",
      "relationship": "founder_of",
      "to": "OZCU-001",
      "status": "active",
      "source_ref": "entity/ENTITY-PASSPORT-OZCU.md",
      "note": "Explicit founder declaration adopted 2026-10-09; legal formalization pending; no corporate registry verification."
    },
    {
      "relationship_id": "REL-009",
      "from": "OZCU-001",
      "relationship": "develops",
      "to": "AIO-001",
      "status": "active",
      "source_ref": "entity/ENTITY-PASSPORT-OZCU.md",
      "note": "Explicit founder declaration adopted 2026-10-09; legal formalization pending; no corporate registry verification."
    },
    {
      "relationship_id": "REL-010",
      "from": "DAN-001",
      "relationship": "collaborating_model_in",
      "to": "AIO-001",
      "status": "active",
      "source_ref": "entity/ENTITY-PASSPORT-DANISAN.md",
      "note": "Participation as a collaborating model, reported by the administrator and documented in the private signed-agreement process; no automatic agency, employment, ownership or commercial mandate implied."
    }
  ],
  "graph_rule": "Canonical entities remain distinct. Relationships connect entities but do not collapse their identities. Platform profiles, content assets, playlists, images and research records are representation or resource nodes and must not be promoted to sameAs identity claims unless they actually represent the same entity. AIO CODE remains the primary public/project brand; OZCU is the company/officially adopted declared developer company/venture of AIO CODE, with legal formalization pending through 2027.",
  "ecosystem_rule": "Each canonical entity may have its own connected ecosystem of platforms, content, projects, sources and relationships. Empty registries represent known architectural slots, not invented assets."
}
